{
  "schema_version": "schauwerk-fundus-asset.v1",
  "id": "hall-of-memory.stellar-frame.02",
  "family": "hall-of-memory.stellar-frame",
  "recipe": "raster-png-v1",
  "sources": [
    {
      "role": "original",
      "sha256": "dcbbd40a83a96cb52be6f7f28a7b176f25b8606b8566358642462fe5eff559a5",
      "media_type": "image/png",
      "origin": "chatgpt-images:hall-of-memory-frame-variant-batch-20260813",
      "rights_status": "owned"
    }
  ],
  "properties": {
    "mask_safe": true,
    "mirror_safe": false,
    "recolor_safe": true,
    "rotate_safe": false,
    "tile_safe": false
  }
}
