{
  "schema_version": "schauwerk-fundus-asset.v1",
  "id": "hall-of-memory.stellar-frame.03",
  "family": "hall-of-memory.stellar-frame",
  "recipe": "vtracer-alpha-mask-v1",
  "sources": [
    {
      "role": "trace_source",
      "sha256": "6bbc65014245563eb3161b7b0422eaeb76f633fb77ca4a35db50870d6321a01f",
      "media_type": "image/png",
      "origin": "chatgpt-images:hall-of-memory-frame-variant-batch-20260813",
      "rights_status": "owned"
    }
  ],
  "properties": {
    "mask_safe": true,
    "mirror_safe": false,
    "recolor_safe": true,
    "rotate_safe": false,
    "tile_safe": false
  }
}
